<?xml version="1.0" encoding="UTF-8"?>
<!DOCTYPE npc SYSTEM "Rule.dtd">

		<npc name = "Peter">
			<Line id = "000">
				<text name = "Marchand" > Bienvenu aventurier ! Que venez-vous faire ici ? </text>
				<options>
					<option action = "002">Qu'avez-vous Ã  vendre ?</option>
					<option action = "001">Au revoir.</option>
				</options>
			</Line>
			<Line id="001">
				<text>Au revoir! Revenez vite !</text>
			</Line>
			<Line id="002">
				<text> Regardez donc !</text>
			</Line>
		</npc>

